{
  "$schema": "https://json-schema.org/draft/2020-12/schema",
  "$id": "https://meridianverity.com/schemas/haltseal_gateway_proof_receipt.schema.json",
  "title": "HALTSEAL Gateway Proof Receipt",
  "type": "object",
  "additionalProperties": false,
  "required": [
    "artifact",
    "receipt_type",
    "receipt_version",
    "receipt_tool_release",
    "generated_at",
    "public_eval_version",
    "repository",
    "release",
    "release_sha256",
    "vector_result",
    "expected_tests",
    "enabled_public_eval_hook",
    "public_boundary",
    "rights_posture",
    "receipt_purpose",
    "notices",
    "diligence_next_step",
    "evidence_hash",
    "evidence_sig"
  ],
  "properties": {
    "artifact": {"const": "HALTSEAL Gateway Proof Pack"},
    "receipt_type": {"const": "HALTSEAL_GATEWAY_PROOF_RECEIPT"},
    "receipt_version": {"const": "v1"},
    "receipt_tool_release": {"type": "string", "pattern": "^v0\\.3\\.1-proof-receipt$"},
    "generated_at": {"type": "string", "pattern": "^\\d{4}-\\d{2}-\\d{2}T\\d{2}:\\d{2}:\\d{2}Z$"},
    "public_eval_version": {"const": "v0.3.0-public-eval"},
    "repository": {"const": "https://github.com/meridianverity/haltseal"},
    "release": {"const": "https://github.com/meridianverity/haltseal/releases/tag/v0.3.0-public-eval"},
    "release_sha256": {"type": "string", "pattern": "^[0-9a-f]{64}$"},
    "vector_result": {
      "type": "object",
      "additionalProperties": false,
      "required": ["passed", "total", "failed"],
      "properties": {
        "passed": {"const": 32},
        "total": {"const": 32},
        "failed": {"const": 0}
      }
    },
    "expected_tests": {
      "type": "object",
      "additionalProperties": false,
      "required": ["pytest_passed"],
      "properties": {
        "pytest_passed": {"type": "integer", "minimum": 1}
      }
    },
    "enabled_public_eval_hook": {"const": "network_egress_gateway"},
    "public_boundary": {"const": "synthetic evaluation only; no production SDK; no patent license"},
    "rights_posture": {
      "type": "array",
      "minItems": 5,
      "items": {"type": "string"},
      "contains": {"const": "no production SDK"}
    },
    "receipt_purpose": {"type": "string", "minLength": 1},
    "notices": {
      "type": "array",
      "minItems": 4,
      "items": {"type": "string"},
      "contains": {"const": "not a certificate"}
    },
    "diligence_next_step": {"type": "string", "minLength": 1},
    "evidence_hash": {"type": "string", "pattern": "^[0-9a-f]{64}$"},
    "evidence_sig": {
      "type": "object",
      "additionalProperties": false,
      "required": ["alg", "kid", "sig"],
      "properties": {
        "alg": {"const": "HS256-SYNTHETIC"},
        "kid": {"type": "string", "minLength": 1},
        "sig": {"type": "string", "minLength": 1}
      }
    }
  }
}
